,songs,lyrics
65,SwallowedInTheSea.txt,"['You cut me down a tree\n', 'And brought it back to me\n', ""And that's what made me see\n"", 'Where I was going wrong\n', 'You put me on a shelf\n', 'And kept me for yourself\n', 'I can only blame myself\n', 'You can only blame me\n', '\n', 'And I could write a song\n', 'A hundred miles long\n', ""Well, that's where I belong\n"", 'And you belong with me\n', '\n', 'And I could write it down\n', 'Or spread it all around\n', 'Get lost and then get found\n', 'Or swallowed in the sea\n', '\n', 'You put me on a line\n', 'And hung me out to dry\n', ""And darling that's when I\n"", 'Decided to go to see you\n', '\n', 'You cut me down to size\n', 'And opened up my eyes\n', 'Made me realize\n', 'What I could not see\n', '\n', 'And I could write a book\n', ""The one they'll say that shook\n"", 'The world, and then it took\n', 'It took it back from me\n', '\n', 'And I could write it down\n', 'Or spread it all around\n', 'Get lost and then get found\n', ""And you'll come back to me\n"", 'Not swallowed in the sea\n', '\n', 'Ooh...\n', '\n', 'And I could write a song\n', 'A hundred miles long\n', ""Well, that's where I belong\n"", 'And you belong with me\n', '\n', ""The streets you're walking on\n"", 'A thousand houses long\n', ""Well, that's where I belong\n"", 'And you belong with me\n', '\n', 'Oh what good is it to live\n', 'With nothing left to give\n', 'Forget but not forgive\n', 'Not loving all you see\n', '\n', ""Oh the streets you're walking on\n"", 'A thousand houses long\n', ""Well that's where I belong\n"", 'And you belong with me\n', 'Not swallowed in the sea\n', '\n', 'You belong with me\n', 'Not swallowed in the sea\n', 'Yeah, you belong with me\n', 'Not swallowed in the sea']"
66,Talk_Singles.txt,"[""Oh brother I can't, I can't get through\n"", ""I've been trying hard to reach you, cause I don't know what to do\n"", ""Oh brother I can't believe it's true\n"", ""I'm so scared about the future and I wanna talk to you\n"", 'Oh I wanna talk to you\n', '\n', 'You can take a picture of something you see\n', 'In the future where will I be?\n', 'You can climb a ladder up to the sun\n', 'Or write a song nobody has sung\n', ""Or do something that's never been done\n"", '\n', 'Are you lost or incomplete?\n', ""Do you feel like a puzzle, you can't find your missing piece?\n"", 'Tell me how do you feel?\n', ""Well, I feel like they're talking in a language I don't speak\n"", ""And they're talking it to me\n"", '\n', 'So you take a picture of something you see\n', 'In the future where will I be?\n', 'You can climb a ladder up to the sun\n', 'Or write a song nobody has sung\n', ""Or do something that's never been done\n"", ""Do something that's never been done\n"", '\n', ""So you don't know where you're going, and you wanna talk\n"", ""And you feel like you're going where you've been before\n"", ""You tell anyone who'll listen but you feel ignored\n"", ""Nothing's really making any sense at all\n"", ""Let's talk, let's ta-a-alk\n"", ""Let's talk, let's ta-a-alk""]"
67,TheHardestPart_Singles.txt,"['And the hardest part\n', 'Was letting go, not taking part\n', 'Was the hardest part\n', '\n', 'And the strangest thing\n', 'Was waiting for that bell to ring\n', 'It was the strangest start\n', '\n', 'I could feel it go down\n', 'Bittersweet, I could taste in my mouth\n', 'Silver lining the cloud\n', 'Oh and I\n', 'I wish that I could work it out\n', '\n', 'And the hardest part\n', 'Was letting go, not taking part\n', 'You really broke my heart\n', '\n', 'And I tried to sing\n', 'But I couldn\x92t think of anything\n', 'And that was the hardest part\n', '\n', 'I could feel it go down\n', 'You left the sweetest taste in my mouth\n', ""You're a silver lining the clouds\n"", 'Oh and I\n', 'Oh and I\n', 'I wonder what it\x92s all about\n', 'I wonder what it\x92s all about\n', '\n', 'Everything I know is wrong\n', ""Everything I do, it's just comes undone\n"", 'And everything is torn apart\n', '\n', 'Oh and it\x92s the hardest part\n', 'That\x92s the hardest part\n', 'Yeah that\x92s the hardest part\n', 'That\x92s the hardest part\n']"
68,TilKingdomCome.txt,"['Steal my heart and hold my tongue.\n', 'I feel my time, my time has come.\n', 'Let me in, unlock the door.\n', ""I've never felt this way before.\n"", '\n', 'The wheels just keep on turning,\n', 'The drummer begins to drum,\n', ""I don't know which way I'm going,\n"", ""I don't know which way I've come.\n"", '\n', 'Hold my head inside your hands,\n', 'I need someone who understands.\n', 'I need someone, someone who hears,\n', ""For you, I've waited all these years.\n"", '\n', ""For you, I'd wait 'til kingdom come.\n"", 'Until my day, my day is done.\n', ""And say you'll come, and set me free,\n"", ""Just say you'll wait, you'll wait for me.\n"", '\n', 'In your tears and in your blood,\n', 'In your fire and in your flood,\n', 'I hear you laugh, I heard you sing,\n', '""I wouldn\'t change a single thing.""\n', '\n', 'The wheels just keep on turning,\n', 'The drummers begin to drum,\n', ""I don't know which way I'm going,\n"", ""I don't know what I've become.\n"", '\n', ""For you, I'd wait 'til kingdom come,\n"", 'Until my days, my days are done.\n', ""Say you'll come and set me free,\n"", ""Just say you'll wait, you'll wait for me.\n"", ""Just say you'll wait, you'll wait for me.\n"", ""Just say you'll wait, you'll wait for me.""]"
69,TwistedLogic.txt,"['Sunlight, opened up my eyes\n', 'To see for the first time\n', ""You'll open them up\n"", 'And tonight, rivers will run dry\n', 'And not for the first time\n', 'Rivers will run\n', '\n', 'Hundreds of years in the future\n', 'It could be computers\n', 'Looking for life on earth\n', '\n', ""Don't fight for the wrong side\n"", 'Say what you feel like\n', 'Say how you feel\n', '\n', ""You'll go backwards, but then\n"", ""You'll go forwards again\n"", ""You'll go backwards, but then\n"", ""You'll go\n"", '\n', 'Created, then drilled and invaded\n', 'If somebody made it\n', 'Someone will mess it up\n', '\n', 'And you are not wrong to\n', 'Ask who does this belong to\n', 'It belongs to all of us\n', '\n', ""You'll go backwards, but then\n"", ""You'll go forwards again\n"", ""You'll go backwards, but then\n"", ""you'll go forwards\n"", '\n', ""You'll go backwards, but then\n"", ""you'll go forwards again\n"", ""You'll go forwards again\n"", ""You'll go forwards\n""]"
70,WhatIf.txt,"['What if there was no light\n', 'Nothing wrong, nothing right\n', 'What if there was no time\n', 'And no reason, or rhyme\n', 'What if you should decide\n', ""That you don't want me there by your side\n"", ""That you don't want me there in your life\n"", 'What if I got it wrong\n', 'And no poem or song\n', 'Could put right what I got wrong\n', 'Or make you feel I belong\n', '\n', 'What if you should decide\n', ""That you don't want me there by your side\n"", ""That you don't want me there in your life\n"", '\n', ""Ooh ooh-ooh, that's right\n"", ""Let's take a breath, jump over the side\n"", ""Ooh ooh-ooh, that's right\n"", ""How can you know it, if you don't even try\n"", ""Ooh ooh-ooh, that's right\n"", '\n', 'Every step that you take\n', 'Could be your biggest mistake\n', 'It could bend or it could break\n', ""That's the risk that you take\n"", '\n', 'What if you should decide\n', ""That you don't want me there in your life\n"", ""That you don't want me there by your side\n"", '\n', ""Ooh ooh-ooh, that's right\n"", ""Let's take a breath, jump over the side\n"", ""Ooh ooh-ooh, that's right\n"", ""How can you know when you don't even try\n"", ""Ooh ooh-ooh, that's right\n"", '\n', ""Oh - Ooh ooh-ooh, that's right,\n"", ""Let's take a breath, jump over the side.\n"", ""Ooh ooh-ooh, that's right,\n"", 'You know that darkness always turns into light.\n', ""Ooh-ooh, that's right""]"
71,WhiteShadows.txt,"['When I was a young boy I tried to listen\n', 'And I want to feel like that\n', 'Little white shadows blink and miss them\n', 'Part of a system, I am\n', '\n', 'If you ever feel like\n', ""Something's missing\n"", 'Things you never understand\n', 'Little white shadows sparkle and glisten\n', 'Part of a system a plan\n', '\n', ""All this noise I'm waking up\n"", ""All the space I'm taking up\n"", 'All this sound is breaking up\n', '\n', ""Maybe you'll get what you wanted\n"", ""Maybe you'll stumble upon it\n"", 'Everything you ever wanted in a permanent state\n', ""Maybe you'll know when you've seen it\n"", ""Maybe if you say it you'll mean it\n"", ""And when you find it you'll keep it\n"", 'In a permanent state\n', 'A permanent state\n', '\n', 'When I was a young boy I tried to listen\n', ""Don't you want to feel like that?\n"", ""You're part of the human race\n"", 'All of the stars and the outer space\n', 'Part of a system a plan\n', '\n', ""All this noise I'm waking up\n"", ""All the space I'm taking up\n"", ""I cannot hear, you're breaking up\n"", '\n', ""Maybe you'll get what you wanted\n"", ""Maybe you'll stumble upon it\n"", 'Everything you ever wanted in a permanent state\n', ""Maybe you'll know when you've seen it\n"", ""Maybe if you say it you'll mean it\n"", ""And when you find it you'll keep it\n"", 'In a permanent state\n', 'A permanent state\n', '\n', 'Swim out on a sea of faces\n', 'The tide of the human races\n', 'An answer now is what I need\n', 'See it in the new sun rise and\n', 'See it break on your horizon\n', 'Oh come on love\n', 'Stay with me']"
72,X&Y.txt,"['Trying hard to speak and\n', 'Fighting with my weak hand\n', 'Driven to distraction\n', 'So part of the plan\n', 'When something is broken\n', 'And you try to fix it\n', 'Trying to repair it\n', 'Any way you can\n', ""I'm diving off the deep end\n"", 'You become my best friend\n', 'I wanna love you\n', ""But I don't know if I can\n"", 'I know something is broken\n', ""And I'm trying to fix it\n"", 'Trying to repair it\n', 'Any way I can\n', '\n', 'Ooh ooh ooh ooh ooh ooh...\n', '\n', 'You and me are floating on a tidal wave...\n', 'Together\n', 'You and me are drifting into outer space...\n', 'And singing\n', '\n', 'Ooh ooh ooh ooh ooh ooh...\n', '\n', 'You and me are floating on a tidal wave...\n', 'Together\n', 'You and me are drifting into outer space\n', 'You and me are floating on a tidal wave...\n', 'Together\n', 'You and me are drifting into outer space...\n', 'And singing\n', '\n', 'Ooh ooh ooh ooh ooh ooh...']"
