,songs,lyrics
0,AdventureOfALifetime.txt,"['Turn your magic on\n', ""Umi she'd say\n"", ""Everything you want's a dream away\n"", 'And we are legends every day\n', ""That's what she told me\n"", '\n', 'Turn your magic on,\n', ""To me she'd say\n"", ""Everything you want's a dream away\n"", 'Under this pressure, under this weight\n', 'We are diamonds\n', '\n', 'Now I feel my heart beating\n', 'I feel my heart underneath my skin\n', 'And I feel my heart beating\n', 'Oh, you make me feel\n', ""Like I'm alive again\n"", 'Alive again\n', 'Oh, you make me feel\n', ""Like I'm alive again\n"", '\n', ""Said I can't go on,\n"", 'Not in this way\n', ""I'm a dream that died by light of day\n"", 'Gonna hold up half the sky and say\n', 'Only I own me\n', '\n', 'And I feel my heart beating\n', 'I feel my heart underneath my skin\n', 'Oh, I can feel my heart beating\n', ""'Cause you make me feel\n"", ""Like I'm alive again\n"", 'Alive again\n', 'Oh, you make me feel\n', ""Like I'm alive again\n"", '\n', 'Turn your magic on,\n', ""Umi she'd say\n"", ""Everything you want's a dream away\n"", 'Under this pressure under this weight\n', 'We are diamonds taking shape\n', 'We are diamonds taking shape\n', '\n', ""If we've only got this life\n"", 'This adventure, oh, then I\n', ""And if we've only got this life\n"", 'You get me through\n', '\n', ""And if we've only got this life\n"", 'In this adventure, oh, then I\n', 'Want to share it with you\n', 'With you\n', 'With you\n', 'Yeah I do\n', 'Woohoo\n', 'Woohoo\n', 'Woohoo\n']"
1,AHeadFullOfDreams.txt,"[""'Cause you're a sky, 'cause you're a sky full of stars\n"", ""I'm gonna give you my heart\n"", ""'Cause you're a sky, 'cause you're a sky full of stars\n"", ""'Cause you light up the path\n"", '\n', ""I don't care, go on and tear me apart\n"", ""I don't care if you do, ooh\n"", ""'Cause in a sky, 'cause in a sky full of stars\n"", 'I think I saw you\n', '\n', ""'Cause you're a sky, 'cause you're a sky full of stars\n"", 'I wanna die in your arms\n', ""'Cause you get lighter the more it gets dark\n"", ""I'm gonna give you my heart\n"", '\n', ""I don't care, go on and tear me apart\n"", ""I don't care if you do, ooh\n"", ""'Cause in a sky, 'cause in a sky full of stars\n"", 'I think I see you\n', 'I think I see you\n', '\n', ""'Cause you're a sky, you're a sky full of stars\n"", 'Such a heavenly view\n', ""You're such a heavenly view\n"", '\n']"
2,AmazingDay.txt,"['We sat on a roof, named every star\n', 'Shared every bruise and showed every scar\n', 'Hope has its proof put your hand in mine, saying\n', '""Life has a beautiful, crazy design""\n', '\n', 'And time seemed to say\n', '""Forget the world and it\'s weight""\n', 'And here I just want to stay\n', '\n', 'Amazing day\n', 'Amazing day\n', '\n', 'We sat on a roof, named every star \n', 'You showed me a place\n', 'Where you can be what you are\n', '\n', 'And the view, the whole Milky Way\n', 'In your eyes, I drifted away\n', 'And in your arms I just want to sway\n', '\n', 'Amazing day\n', 'Amazing day\n', 'Amazing day\n', 'Amazing day\n', '\n', 'Oh-oh-oh-oh, oh-oh-oh-oh, oh-oh-oh-oh, oh-oh-oh-oh\n', 'Oh-oh-oh-oh, oh-oh-oh-oh, oh-oh-oh-oh, oooh\n', '\n', 'And I asked \n', 'Can the Birds in poetry, chime?\n', 'Can there be breaks in the chaos sometimes?\n', 'Oh, thanks God, must have heard when I prayed\n', 'Cause now I always want to feel this way\n', '\n', 'Amazing day\n', 'Amazing day\n', 'Amazing day\n', 'Amazing day\n', 'Yeah, today\n']"
3,ArmyOfOne.txt,"['Been around the world, the wonders to view\n', 'Been around the world, looking for someone like you\n', 'Pyramids try, Babylon too\n', 'But the beautifullest treasures lie in the deepest blue\n', '\n', 'So I never say die, aim never untrue\n', ""I'm never so high as when I'm with you\n"", ""And there isn't a fire, that I wouldn't walk through\n"", 'My army of one is gonna fight for you\n', '\n', 'Been around the world, universe too\n', ""Been around flying, baby, there's nothing I wouldn't do\n"", 'Tanzaku stars, Lasso the moon\n', 'And be standing there beside you\n', 'Right when the storm comes through\n', '\n', ""'Cause I never say die, aim never untrue\n"", ""Never so high as when I'm with you\n"", ""And there isn't a fire, that I wouldn't walk through\n"", 'My army of one is gonna fight for you\n', 'My army of one is gonna fight for you, yeah!\n', '\n', ""'Cause you reign, all 'cause you reign\n"", ""All 'cause you reign\n"", 'My army of one is gonna call it through\n', '\n', 'Sayin my heart is my gun, army of one\n', 'Yeah my heart is my gun, army of one\n', ""It's my only weapon, army of one\n"", 'Yeah my heart is my gun, army of one\n', '\n']"
4,Birds.txt,"['Been standing in the corner\n', 'Studying the lights\n', 'The dreaming of escape\n', 'Will keep you up at night\n', '\n', 'But someone had put the flare up\n', 'Got me in rays\n', 'So... I guess I better stay\n', '\n', '""Uh uh, no come on!"" you say\n', '\n', ""It's a fools gold thunder\n"", ""It's just warning rain\n"", ""Don't let the fears just start, what if\n"", ""I won't see you again\n"", 'Around here you never want to\n', 'Sleep all night\n', '\n', 'So start falling in love,\n', 'Start the riot\n', 'And come on rage with me\n', '\n', ""We don't need words\n"", ""We'll be birds\n"", 'Got to make our own key\n', '\n', 'Only got this moment\n', 'You and me\n', 'Guilty of nothing\n', 'But geography\n', '\n', 'Come on and raise it\n', 'Come on raise this noise\n', 'For the million people\n', 'Who got not one voice\n', ""Come on, it's not over!\n"", 'If you mean it say loud\n', 'Come on, all for love\n', 'Out from the underground\n', '\n', 'Away with me\n', ""We don't need words\n"", 'Close your eyes and see\n', ""We'll be birds\n"", 'Flying free\n', 'Holding on in the mystery\n', '\n', 'Fearless through this you said\n', ""We'll go\n"", 'Through this together (ooohh)\n', ""When you fly won't you\n"", ""Won't you take me too?\n"", 'In this world so cruel\n', ""I think you're so cool""]"
5,Everglow.txt,"['Oh they say people come\n', 'They say people go\n', 'This particular diamond was extra special\n', 'And though you might be gone\n', 'And the world may not know\n', 'Still I see you celestial\n', '\n', 'Like a lion you ran\n', 'A goddess you rolled\n', 'Like an eagle you circled\n', 'In perfect purple\n', 'So how come things move on\n', ""How come cars don't slow\n"", 'When it feels like the end of my world?\n', ""When I should but I can't let you go?\n"", '\n', ""But when I'm cold, cold\n"", ""When I'm cold, cold\n"", ""There's a light that you give me\n"", ""When I'm in shadow\n"", ""There's a feeling within me, an everglow\n"", '\n', 'Like brothers in blood\n', 'Sisters who ride\n', 'Yeah, we swore on that night\n', ""We'd be friends 'til we died\n"", 'But the changing of winds\n', 'And the way waters flow\n', 'Life as short as the falling of snow\n', ""And now I'm gonna miss you, I know\n"", '\n', ""But when I'm cold, cold\n"", 'In water rolled, salt\n', ""And I know that you're with me\n"", 'And the way you will show\n', ""And you're with me wherever I go\n"", ""'Cause you give me this feeling, this everglow\n"", '\n', ""What I wouldn't give for just a moment to hold\n"", 'Yeah, I live for this feeling, this everglow\n', '\n', 'So if you love someone, you should let them know\n', 'Oh, the light that you left me will everglow\n', '\n']"
6,Fun.txt,"['[Coldplay:]\n', ""I know it's over before she says\n"", 'I know it falls at the water face\n', ""I know it's over, an ocean awaits\n"", 'For a storm\n', 'The sun on snow, rivers in rain\n', 'Crystal ball can foresee a change\n', ""And I know it's over, a parting of ways\n"", ""And it's done\n"", '\n', '[Coldplay:]\n', ""But didn't we have fun?\n"", ""Don't say it was all a waste\n"", ""Didn't we have fun?\n"", 'From the top of the world\n', 'Top of the waves\n', 'We said forever, forever always\n', 'We could have been lost\n', 'We would have been saved\n', ""Now we're stopping the world, stopping its spin\n"", ""Oh, come on don't give up\n"", ""Don't see me give in\n"", ""Don't say it's over\n"", ""Don't say we're done\n"", ""Oh, didn't we have fun?\n"", ""Oh, didn't we have fun?\n"", '\n', '[Coldplay & Tove Lo:]\n', ""I know it's over before she says\n"", 'Know someone else has taken your place\n', '""I know it\'s over,"" Icarus says\n', 'To the sun\n', 'The sword sinks in, lightning strikes\n', 'And two force, two forces collide\n', ""And fight 'til it's over,\n"", ""Fight 'til it's done\n"", '\n', '[Coldplay & Tove Lo:]\n', ""But didn't we have fun?\n"", ""Don't say it was all a waste\n"", ""Didn't we have fun?\n"", 'From the top of the world\n', 'Top of the waves\n', 'We said forever, forever always\n', 'We could have been lost\n', 'We would have been saved\n', ""Now we're stopping the world, stopping in its tracks\n"", ""But nothing's too broken to find a way back\n"", ""Before it's over, before you run\n"", ""Ah, didn't we have fun?\n"", '\n', '[Coldplay & Tove Lo:]\n', ""'Cause you and me\n"", 'We were always meant to... always meant to be\n', 'We were always meant to... always meant to\n', 'You and me\n', 'We were always meant to... always meant to be\n', '\n', ""Oh, didn't we have fun?\n"", ""Oh, didn't we have fun?\n"", '\n', '[Coldplay:]\n', 'But then...\n', 'Maybe we could again\n']"
7,HymnForTheWeekend.txt,"['[Beyonc\xe9:]\n', 'Drink from me, drink from me\n', ""Then we'll shoot across the sky\n"", 'Symphony\n', ""Then we'll shoot across the sky\n"", ""We're on a...\n"", 'Drink from me, drink from me\n', ""Then we'll shoot across the sky\n"", 'Symphony\n', '(So high, so high)\n', ""Then we'll shoot across the sky\n"", '\n', '[Coldplay:]\n', 'Oh, angel sent from up above\n', 'You know you make my world light up\n', 'When I was down, when I was hurt\n', 'You came to lift me up\n', ""Life is a drink, and love's a drug\n"", 'Oh, now I think I must be miles up\n', 'When I was a river, dried up\n', 'You came to rain a flood\n', '\n', '[Coldplay & Beyonc\xe9:]\n', 'And said drink from me, drink from me\n', 'When I was so thirsty\n', 'Pour on a symphony\n', ""Now I just can't get enough\n"", 'Put your wings on me, wings on me\n', 'When I was so heavy\n', 'Pour on a symphony\n', ""When I'm low, low, low, low\n"", '\n', '[Coldplay:]\n', 'I, oh, I, oh\n', 'Got me feeling drunk and high\n', 'So high, so high\n', 'I, oh, I, oh, I, oh\n', ""Now I'm feeling drunk and high\n"", 'So high, so high\n', 'Woo!\n', '\n', '[Coldplay & Beyonc\xe9:]\n', 'Oh, angel sent from up above\n', 'I feel it coursing through my blood\n', ""Life is a drink, your love's about\n"", 'To make the stars come out\n', '\n', '[Coldplay & Beyonc\xe9:]\n', 'Put your wings on me, wings on me\n', 'When I was so heavy\n', 'Pour on a symphony\n', ""When I'm low, low, low, low\n"", '\n', '[Coldplay:]\n', 'I, oh I, oh I\n', 'Got me feeling drunk and high\n', 'So high, so high\n', 'Oh I, oh I, oh I\n', ""I'm feeling drunk and high\n"", 'So high, so high\n', '\n', '[Beyonc\xe9 & Coldplay:]\n', 'I, oh I, oh I\n', 'La la la la la la la\n', 'So high, so high\n', 'I, oh I, oh I\n', ""I'm feeling drunk and high\n"", 'So high, so high\n', '\n', '[Beyonc\xe9:]\n', ""Then we'll shoot across the sky\n"", ""Then we'll shoot across the...\n"", ""Then we'll shoot across the sky\n"", ""Then we'll shoot across the...\n"", ""Then we'll shoot across the sky\n"", ""Then we'll shoot across the...\n"", ""Then we'll shoot across the sky\n"", ""Then we'll shoot across the...\n""]"
8,Kaleidoscope.txt,"['Kaleidoscope""\n', '\n', 'This being human is a guest house\n', 'Every morning a new arrival\n', '\n', 'A joy, a depression, a meanness\n', 'Some momentary awareness comes\n', 'As an unexpected visitor\n', '\n', 'Welcome and entertain them all!\n', 'Be grateful for whoever comes\n', 'Because each has been sent as a guide']"
9,UpAndUp.txt,"['Fixing up a car to drive in it again\n', 'Searching for the water, hoping for the rain\n', 'Up and up\n', 'Up and up\n', '\n', 'Down upon the canvas, working meal to meal\n', 'Waiting for a chance to pick on your orange field\n', 'Up and up\n', 'Up and up\n', '\n', 'See a pearl form a diamond in the rough\n', 'See a bird soaring high above the flood\n', ""It's in your blood\n"", ""It's in your blood\n"", '\n', 'Underneath the storm, an umbrella is saying,\n', '""Sitting with the poison takes away the pain.""\n', 'Up and up\n', 'Up and up, saying\n', '\n', ""We're gonna get it, get it together right now\n"", 'Gonna get it, get it together somehow\n', 'Gonna get it, get it together and flower\n', ""We're gonna get it, get it together, I know\n"", 'Gonna get it, get it together and flow\n', 'Gonna get it, get it together and go\n', 'Up and up and up\n', '\n', 'Lying in the gutter, aiming for the moon\n', 'Trying to empty out the ocean with a spoon\n', 'Up and up\n', 'Up and up\n', '\n', 'How come people suffer? How come people part?\n', 'How come people struggle? How come people break your heart?\n', 'Break your heart, oh\n', '\n', 'Yes, I wanna grow, yes, I wanna feel\n', 'Yes, I wanna know, show me how to heal it up\n', 'Heal it up, oh\n', '\n', 'Try and see the forest, there in every seed\n', 'Angels in the marble waiting to be freed\n', 'Just need love\n', 'Just need love\n', '\n', 'When the going is rough, saying\n', '\n', ""We're gonna get it, get it together right now\n"", 'Gonna get it, get it together somehow\n', 'Gonna get it, get it together and flower\n', ""We're gonna get it, get it together, I know\n"", 'Gonna get it, get it together and flow\n', 'Gonna get it, get it together and go\n', '\n', 'But you can say what is, or fight for it\n', 'Close your mind or take a risk\n', 'You can say, ""It\'s mine,"" and clench your fist\n', 'Or see each sunrise as a gift\n', '\n', '[2x]\n', ""We're gonna get it, get it together right now\n"", 'Gonna get it, get it together somehow\n', 'Gonna get it, get it together and flower\n', ""We're gonna get it, get it together, I know\n"", 'Gonna get it, get it together and flow\n', 'Gonna get it, get it together and go\n', '\n', 'Up and up and up\n', '\n', 'Oh\n', '\n', 'Fixing up a car to drive in it again\n', ""When you're in pain, when you think you've had enough\n"", ""Don't ever give up\n"", ""Don't ever give up\n"", '\n', 'Believe in love']"
10,XMarksTheSpot.txt,"['(So I reach for it)\n', '\n', 'Stare into darkness, staring at doom\n', 'My heart go boom, bo-boom boom\n', 'Stare into darkness, admit defeat\n', ""Coming home and I'm finding no peace\n"", '\n', 'And I know, and I know and I know\n', ""I know I'm out of luck\n"", 'And I know, and I know and I know\n', ""I know what you've got\n"", '\n', 'I put my hands up to the sky, the feeling is like\n', ""I've got a rocketship that I want to ride\n"", 'I put my hands up to the sky, the feeling is like\n', ""Wherever you are, I'll find that treasure\n"", '\n', ""(So I reach for it) Wherever you are, I'll find that treasure\n"", '(So I reach for it)\n', '\n', 'Stare into darkness, staring at doom\n', 'You make my heart go boom, bo-boom boom\n', 'Superhero, a masterpiece\n', 'Been innocent but a sinner in me\n', '\n', 'And I know, and I know and I know\n', ""I know I'm in luck\n"", 'And I know, and I know and I know\n', ""I know when I'm not\n"", '\n', ""I just put my hands up to the sky, I'm feeling like\n"", ""I've got a rocketship that I want to ride\n"", 'I put my hands up to the sky, the feeling is like\n', ""Wherever you are, I'll find that treasure\n"", '\n', 'I just put my hands up to the sky, the feeling is like\n', ""I've got a rocket, eyes on the prize\n"", ""I put my hands up to the sky, I'm gonna find\n"", ""Wherever you are, I'll find that treasure\n"", '\n', ""(So I reach for it) Wherever you are, I'll find that treasure\n"", ""(So I reach for it) Wherever you are, I'll find that treasure\n"", '(So I reach for it) And I know, and I know, and I know\n', ""(So I reach for it) I know what I've got\n"", 'X marks the spot\n', '\n', ""I just put my hands up to the sky, I'm feeling like\n"", ""I've got a rocketship that I want to ride\n"", 'I put my hands up to the sky, the feeling is like\n', ""Wherever you are, I'll find that treasure\n"", '\n', ""I just put my hands up to the sky, I'm feeling like\n"", ""I've got a rocketship that I want to ride\n"", 'I put my hands up to the sky, the feeling is like\n', ""Wherever you are, I'll find that treasure\n"", '\n', '\n', ' ']"
11,Amsterdam.txt,"['Come on, oh my star is fading \n', 'And I swerve out of control\n', ""If I, if I'd only waited\n"", ""I'd not be stuck here in this hole \n"", 'Come here, oh my star is fading\n', 'And I swerve out of control\n', 'And I swear, I waited and waited\n', ""I've got to get out of this hole\n"", '\n', 'But time is on your side, its on your side, now\n', 'Not pushing you down, and all around\n', ""It's no cause for concern\n"", '\n', 'Come on, oh my star is fading\n', 'And I see no chance of release\n', ""And I know I'm dead on the surface\n"", 'But I am screaming underneath\n', '\n', 'And time is on your side, its on your side, now\n', 'Not pushing you down, and all around\n', ""No it's no cause for concern\n"", '\n', 'Stuck on the end of this ball and chain\n', ""And I'm on my way back down again\n"", 'Stood on the edge, tied to the noose\n', 'Sick to the stomach\n', '\n', 'You can say what you mean\n', ""But it won't change a thing\n"", ""I'm sick of the secrets\n"", 'Stood on the edge, tied to the noose\n', 'And you came along and you cut me loose\n', 'You came along and you cut me loose\n', 'You came along and you cut me loose']"
12,ARushOfBloodToTheHead.txt,"[""You said I'm gonna buy this place and burn it down \n"", ""I'm gonna put it six feet underground \n"", ""You said I'm gonna buy this place and watch it fall\n"", 'Stand here beside me baby in the crumbling walls \n', ""Oh I'm gonna buy this place and start a fire\n"", 'Stand here until I fill all your hearts desires\n', ""Because I'm gonna buy this place and see it burn\n"", 'And do back the things it did to you in return\n', '\n', 'Huuuhhhh [x4]\n', '\n', ""You said I'm gonna buy a gun and start a war\n"", 'If you can tell me something worth fighting for\n', ""Oh and I'm gonna buy this place is what I said\n"", 'Blame it upon a rush of blood to the head\n', '\n', ""Honey, all the movements you're starting to make\n"", 'See me crumble and fall on my face\n', ""And I know the mistakes that I've made\n"", 'See it all disappear without trace\n', 'And they call as they beckon you on\n', 'They say start as you need to go on\n', 'Start as you need to go on\n', '\n', ""You said I'm gonna buy this place and see it go\n"", 'And stand here beside me baby, watch the orange glow\n', ""Some'll laugh and some just sit and cry\n"", 'But you just sit down there and you wonder why\n', '\n', ""So I'm gonna buy a gun and start a war\n"", 'If you can tell me something worth fighting for\n', ""And I'm gonna buy this place is what I said\n"", 'Blame it upon a rush of blood to the head\n', 'Oh to the head\n', '\n', ""Honey, all the movements you're starting to make\n"", 'See me crumble and fall on my face\n', ""And I know the mistakes that I've made\n"", 'See it all disappear without trace\n', 'And they call as they beckon you on\n', 'They say start as you need to go on\n', 'As you need to go on\n', 'As you need to go on\n', '\n', 'So meet me by the bridge\n', 'Oh meet me by the lane\n', 'When am I gonna see that pretty face again\n', 'Oh meet me on the road\n', 'Meet me where I said\n', 'Blame it all upon a rush of blood to the head']"
13,AWhisper.txt,"['A whisper \n', 'A whisper\n', 'A whisper\n', 'A whisper\n', '\n', 'A whisper\n', 'A whisper\n', 'A whisper\n', 'A whisper\n', '\n', 'I hear the sound of a ticking of clocks\n', 'Remember your face, and remember see where you are gone\n', 'I hear the sound of the ticking of clocks\n', 'Come back and look for me, look for me when I am lost\n', '\n', 'Just a whisper, whisper, whisper, whisper \n', 'Just a whisper, whisper, whisper, whisper\n', '\n', 'Night turns to day and I still have these questions\n', ""You just won't break, should I go forwards or backwards\n"", ""Night turns to day and I've still got no answers\n"", '\n', 'Just a whisper, whisper, whisper, whisper \n', 'Just a whisper, whisper, whisper, whisper\n', '\n', 'Now I hear the sound of a ticking of clocks\n', 'Remember your face, and remember see where you are gone\n', 'I hear the sound of the ticking of clocks\n', 'Come back and look for me, look for me when I am lost\n', '\n', 'Just a whisper, whisper, whisper, whisper \n', 'Just a whisper, whisper, whisper, whisper']"
14,Clocks.txt,"[""The lights go out and I can't be saved\n"", 'Tides that I tried to swim against\n', 'Have brought me down upon my knees\n', 'Oh I beg, I beg and plead, singing\n', '\n', 'Come out of things unsaid\n', 'Shoot an apple off my head and a\n', ""Trouble that can't be named\n"", ""A tiger's waiting to be tamed, singing\n"", '\n', 'You are\n', 'You are\n', '\n', 'Confusion never stops\n', 'Closing walls and ticking clocks \n', 'Gonna come back and take you home\n', 'I could not stop that you now know, singing\n', '\n', 'Come out upon my seas\n', 'Cursed missed opportunities \n', 'Am I a part of the cure?\n', 'Or am I part of the disease? Singing\n', '\n', 'You are, you are, you are \n', 'You are, you are, you are\n', '\n', 'And nothing else compares\n', 'Oh nothing else compares\n', 'And nothing else compares\n', '\n', 'You are \n', 'You are\n', '\n', 'Home, home where I wanted to go \n', 'Home, home where I wanted to go\n', 'Home, home where I wanted to go\n', 'Home, home where I wanted to go']"
15,Daylight.txt,"['To my surprise, and my daylight\n', 'I saw sun rise, I saw sunlight\n', 'I am nothing, in the dark\n', 'And the clouds burst to show a daylight \n', 'Oooooo and the sun shines, Yeaaahhh on this star of mine\n', ""Oooooo and I realise, Oooooo couldn't live without\n"", ""Oooooo couldn't part without, it\n"", '\n', 'On a hill top, on a sky rise\n', 'Like a first born, child\n', 'At a full tilt, and at full flight\n', 'You see darkness, in the daylight\n', '\n', 'Oooooo and the sun shines, Yeaaahhh on this star of mine\n', ""Oooooo and I realise, Oooooo couldn't be without\n"", ""Oooooo couldn't part without, daylight\n"", '\n', 'Slowly breaking through the daylight\n', 'Slowly breaking through the daylight\n', 'Slowly breaking through the daylight\n', 'Slowly breaking through the daylight\n', 'Slowly breaking through the daylight\n', 'Slowly breaking through the daylight\n', 'Slowly breaking through the daylight']"
16,GodPutASmileUponYourFace.txt,"['Where do we go nobody knows?\n', ""I've gotta say I'm on my way down\n"", 'God give me style and give me grace\n', 'God put a smile upon my face \n', 'Where do we go to draw the line?\n', ""I've gotta say I wasted all your time, (oh honey honey)\n"", 'Where do I go to fall from grace?\n', 'God put a smile upon your face, yeah\n', '\n', ""Now, when you work it out I'm worse than you\n"", 'Yeah, when you work it out I wanted to\n', 'Now, when you work out where to draw the line\n', 'Your guess is as good as mine\n', '\n', 'Where do we go nobody knows?\n', ""Don't even say you're on your way down, (when)\n"", 'God gave you style and gave you grace\n', 'And put a smile upon your face, ah yeah\n', '\n', ""Now, when you work it out I'm worse than you\n"", 'Yeah, when you work it out I wanted to\n', 'Now, when you work out where to draw the line\n', 'Your guess is as good as mine\n', 'Its as good as mine [x7]\n', '\n', 'Where do we go nobody knows?\n', ""Don't even say you're on your way down, (when)\n"", 'God gave you style and gave you grace\n', 'And put a smile upon your face']"
17,GreenEyes.txt,"['Honey you are a rock\n', 'Upon which I stand\n', 'And I came here to talk\n', 'I hope you understand \n', 'The green eyes, yeah the spotlight, shines upon you\n', 'And how could, anybody, deny you\n', 'I came here with a load\n', 'And it feels so much lighter now I met you\n', 'And honey you should know\n', 'That I could never go on without you\n', 'Green eyes\n', '\n', 'Honey you are the sea\n', 'Upon which I float\n', 'And I came here to talk\n', 'I think you should know\n', '\n', ""The green eyes, you're the one that I wanted to find\n"", 'And anyone who tried to deny you, must be out of their mind\n', 'Because I came here with a load\n', 'And it feels so much lighter since I met you\n', 'Honey you should know\n', 'That I could never go on without you\n', 'Green eyes, green eyes\n', 'Oh oh oh oh [x4]\n', '\n', 'Honey you are a rock\n', 'Upon which I stand']"
18,InMyPlace.txt,"['In my place, in my place\n', ""Were lines that I couldn't change\n"", 'I was lost, oh yeah\n', '\n', 'I was lost, I was lost\n', ""Crossed lines I shouldn't have crossed\n"", 'I was lost, oh yeah\n', '\n', 'Yeah, how long must you wait for it?\n', 'Yeah, how long must you pay for it?\n', 'Yeah, how long must you wait for it, oh, for it?\n', '\n', 'I was scared, I was scared\n', 'Tired and under-prepared\n', ""But I'll wait for it\n"", '\n', 'If you go, if you go\n', 'Leave me down here on my own\n', ""Then I'll wait for you, yeah.\n"", '\n', 'Yeah, how long must you wait for it?\n', 'Yeah, how long must you pay for it?\n', 'Yeah, how long must you wait for it, oh, for it?\n', '\n', 'Singing\n', 'Please, please, please\n', 'Come back and sing to me\n', 'To me, to me\n', '\n', 'Come on and sing it out, now, now\n', 'Come on and sing it out to me, me\n', 'Come back and sing it\n', '\n', 'In my place, in my place\n', ""Were lines that I couldn't change\n"", 'And I was lost, oh yeah\n', 'Oh yeah']"
