,songs,lyrics
44,Shiver_Singles.txt,"['So I look in your direction,\n', 'But you pay me no attention, do you?\n', ""I know you don't listen to me.\n"", ""'cause you say you see straight through me, don't you?\n"", '\n', 'And on and on from the moment I wake,\n', 'To the moment I sleep,\n', ""I'll be there by your side,\n"", 'Just you try and stop me,\n', ""I'll be waiting in line,\n"", 'Just to see if you care.\n', '\n', 'Did you want me to change?\n', 'Well I changed for good\n', 'And I want you to know.\n', ""That you'll always get your way\n"", 'I wanted to say,\n', '\n', ""Don't you Shiver?\n"", 'Shiver\n', 'Sing it loud and clear\n', '\n', ""I'll always be waiting for you,\n"", 'So you know how much I need you,\n', 'But you never even see me, do you?\n', 'And is this my final chance of getting you?\n', '\n', 'And on and on from the moment I wake,\n', 'To the moment I sleep,\n', ""I'll be there by your side,\n"", 'Just you try and stop me,\n', ""I'll be waiting in line,\n"", 'Just to see if you care.\n', '\n', 'Oh, oh, oh, oh.\n', '\n', 'Did you want me to change?\n', 'Well I changed for good\n', 'And I want you to know.\n', ""That you'll always get your way\n"", 'I wanted to say,\n', '\n', ""Don't you Shiver?\n"", ""Don't you Shiver?\n"", '\n', 'Sing it loud and clear.\n', ""I'll always be waiting for you.\n"", '\n', ""Yeah I'll always be waiting for you.\n"", ""Yeah I'll always be waiting for you.\n"", ""Yeah I'll always be waiting for you.\n"", 'For you,\n', 'I will always be waiting.\n', '\n', ""And it's you I see, but you don't see me.\n"", ""And it's you I hear, so loud and so clear\n"", 'I sing it loud and clear.\n', ""And I'll always be waiting for you.\n"", '\n', 'So I look in your direction,\n', 'But you pay me no attention,\n', 'And you know how much I need you,\n', 'But you never even see me.']"
45,Sparks.txt,"['Did I drive you away?\n', ""I know what you'll say,\n"", 'You say, ""Oh, sing one we know"",\n', 'But I promise you this,\n', ""I'll always look out for you,\n"", ""That's what I'll do.\n"", '\n', 'I say ""oh,""\n', 'I say ""oh.""\n', '\n', 'My heart is yours,\n', ""It's you that I hold on to,\n"", ""That's what I do,\n"", 'And I know I was wrong,\n', ""But I won't let you down,\n"", '(Oh yeah, yeah, yes I will)\n', '\n', 'I say ""oh"",\n', 'I cry ""oh"".\n', '\n', 'And I saw sparks,\n', 'Yeah I saw sparks,\n', 'And I saw sparks,\n', 'Yeah I saw sparks,\n', 'Sing it out.\n', '\n', 'La, la, la, la, oh\n', 'La, la, la, la, oh\n', 'La, la, la, la, oh']"
46,Spies.txt,"['I awake to find no peace of mind\n', 'I said, how do you live as a fugitive\n', 'Down here where I cannot see so clear\n', 'I said, what do I know\n', 'Show me the right way to go\n', '\n', 'And the spies came out of the water\n', ""But you're feeling so bad cos you know\n"", 'But the spies hide out in every corner\n', 'But you can\x92t touch them no\n', 'Cos they\x92re all spies \n', 'They\x92re all spies\n', '\n', 'I awake to see that no one is free\n', 'We\x92re all fugitives\n', 'Look at the way we live\n', 'Down here I cannot sleep from fear no\n', 'I said which way do I turn\n', 'I forget everything I learned\n', '\n', 'But the spies came out of the water\n', 'But you\x92re feeling so bad cos you know\n', 'But the spies hide out in every corner,\n', 'But you can\x92t touch them no\n', 'Cos they\x92re all spies they\x92re all spies\n', '\n', 'And if we don\x92t hide here\n', 'They\x92re going to find us\n', 'If we don\x92t hide now\n', 'They\x92re going to catch us where we sleep\n', 'And if we don\x92t hide here\n', 'They\x92re going to find us \n', '\n', 'And the spies came out of the water\n', 'And you\x92re feeling so good cos you know\n', 'That those spies hide out in every corner\n', 'They can\x92t touch you no\n', 'Cos they\x92re just spies\n', 'They\x92re just spies\n', 'They\x92re just spies\n', 'They\x92re just spies\n', 'They\x92re just spies']"
47,Trouble_Singles.txt,"['Oh, no, I see\n', ""A spider web, it's tangled up with me,\n"", 'And I lost my head,\n', ""The thought of all the stupid things I'd said,\n"", '\n', ""Oh, no, what's this?\n"", ""A spider web, and I'm caught in the middle,\n"", 'So I turned to run,\n', ""The thought of all the stupid things I've done,\n"", '\n', 'And I never meant to cause you trouble,\n', 'And I never meant to do you wrong,\n', 'And I, well, if I ever caused you trouble,\n', 'Oh no, I never meant to do you harm.\n', '\n', 'Oh, no, I see\n', ""A spider web, and it's me in the middle,\n"", 'So I twist and turn,\n', 'Here am I in my little bubble,\n', 'Singing out...\n', '\n', 'I never meant to cause you trouble,\n', 'And I never meant to do you wrong,\n', 'And I, well, if I ever caused you trouble,\n', 'Oh, no, I never meant to do you harm.\n', '\n', 'They spun a web for me,\n', 'They spun a web for me,\n', 'They spun a web for me.']"
48,WeNeverChange.txt,"['I wanna live life, and never be cruel,\n', 'I wanna live life, and be good to you.\n', '\n', 'I wanna fly,\n', 'And never come down,\n', 'And live my life,\n', 'And have friends around.\n', '\n', 'We never change, do we?\n', 'No, no.\n', 'We never learn, do we?\n', 'So I wanna live in a wooden house,\n', '\n', 'I wanna live life, and always be true,\n', 'I wanna live life, and be good to you,\n', '\n', 'I wanna fly,\n', 'And never come down,\n', 'And I live my life,\n', 'And have friends around.\n', '\n', 'We never change, do we?\n', 'No, no.\n', 'We never learn, do we?\n', 'So I wanna live in a wooden house,\n', 'Where making more friends would be easy.\n', '\n', ""Oh and I don't have a soul to save,\n"", 'Yes, and I sin every single day,\n', '\n', 'We never change, do we?\n', 'We never learn, do we?\n', 'So, I wanna live in a wooden house,\n', 'Where making more friends would be easy.\n', 'I wanna live where the sun comes out.']"
49,Yellow_Singles.txt,"['Look at the stars,\n', 'Look how they shine for you,\n', 'And everything you do,\n', 'Yeah, they were all yellow.\n', '\n', 'I came along,\n', 'I wrote a song for you,\n', 'And all the things you do,\n', 'And it was called ""Yellow"".\n', '\n', 'So then I took my turn,\n', 'Oh what a thing to have done,\n', 'And it was all yellow.\n', '\n', 'Your skin,\n', 'Oh yeah your skin and bones,\n', 'Turn into\n', 'Something beautiful,\n', 'Do you know,\n', 'You know I love you so,\n', 'You know I love you so.\n', '\n', 'I swam across,\n', 'I jumped across for you,\n', 'Oh what a thing to do.\n', ""'Cause you were all yellow,\n"", '\n', 'I drew a line,\n', 'I drew a line for you,\n', 'Oh what a thing to do,\n', 'And it was all yellow.\n', '\n', 'Your skin,\n', 'Oh yeah your skin and bones,\n', 'Turn into\n', 'Something beautiful,\n', 'Do you know,\n', ""For you I'd bleed myself dry,\n"", ""For you I'd bleed myself dry.\n"", '\n', ""It's true,\n"", 'Look how they shine for you,\n', 'Look how they shine for you,\n', 'Look how they shine for,\n', 'Look how they shine for you,\n', 'Look how they shine for you,\n', 'Look how they shine.\n', '\n', 'Look at the stars,\n', 'Look how they shine for you,\n', 'And all the things that you do.']"
50,42.txt,"['Those who are dead are not dead \n', 'They\x92re just living in my head \n', 'And since I fell for that spell \n', 'I am living there as well \n', 'Oh.. \n', '\n', 'Time is so short and I\x92m sure \n', 'There must be something more \n', '\n', 'Those who are dead are not dead \n', 'They\x92re just living in my head oh\x85 \n', 'And since I fell for that spell \n', 'I am living there as well oh\x85 \n', '\n', 'Time is so short and I\x92m sure \n', 'There must be something more \n', '\n', '\n', 'You thought you might be a ghost \n', 'You thought you might be a ghost \n', 'You didn\x92t get to heaven but you made it close \n', 'You didn\x92t get to heaven but you made it close \n', '\n', 'You thought you might be a ghost \n', 'You thought you might be a ghost \n', 'You didn\x92t get to heaven but you made it close \n', 'You didn\x92t get to heaven but you oh-oh-ooh, oh-oh-ooh \n', 'Oh oh\x85 \n', '\n', 'Those who are dead are not dead \n', 'They\x92re just living in my head \n', 'Oh..\n']"
51,CemeteriesOfLondon.txt,"['At night they would go walking \x91til the breaking of the day, \n', 'The morning is for sleeping\x85 \n', 'Through the dark streets they go searching to seek God in their own way, \n', 'Save the nighttime for your weeping\x85 \n', 'Your weeping\x85 \n', '\n', 'Singing la lalalala la le\x85 \n', 'And the night over London rang. \n', 'So we rode down to the river where the toiling ghosts strain \n', 'for their curses to be broken\x85 \n', 'We\x92d go underneath the arches where the witches are in there saying \n', 'There are ghost towns in the ocean\x85 \n', 'The ocean\x85 \n', 'Singing la lalalala la le\x85 \n', 'And the night over London rang. \n', '\n', 'God is in the houses and God is in my head\x85 and all the cemeteries in London\x85 \n', 'I see God come in my garden, but I don\x92t know what he said, \n', 'For my heart, it wasn\x92t open\x85 \n', 'Not open\x85 \n', '\n', 'Singing la lalalala la le\x85 \n', 'and the night over London rang. \n', 'Singing la lalalala la le\x85 \n', ""There's no light over London today.""]"
52,DeathAndAllHisFriends.txt,"['All winter we got carried\n', ""Oh way over on the rooftops let's get married.\n"", 'All summer we just hurried\n', ""So come over, just be patient, and don't worry.\n"", ""So come over, just be patient, and don't worry.\n"", '\n', ""So come over, just be patient, and don't worry.\n"", '\n', ""And don't worry.\n"", '\n', ""No, I don't wanna battle from beginning to end;\n"", ""I don't want a cycle of recycled revenge;\n"", ""I don't want to follow death and all of his friends.\n"", '\n', ""No, I don't wanna battle from beginning to end;\n"", ""I don't want a cycle of recycled revenge;\n"", ""I don't want to follow death and all of his friends.\n"", '\n', 'And in the end, we lie awake\n', 'And we dream of making escape.\n', '\n', 'And in the end, we lie awake\n', 'And we dream of making escape.\n']"
53,LifeInTechnicolorII.txt,"[""There's a wild wind blowing,\n"", 'Down the corner of my street\n', 'Every night there the headlights are glowing\n', '\n', 'Theres a cold war coming, \n', 'On the radio I heard\n', ""Baby it's a violent world\n"", '\n', ""Oh love don't let me go\n"", ""Won't you take me where the streetlights glow\n"", 'I could hear it coming\n', 'I could hear the sirens sound\n', ""Now my feet won't touch the ground\n"", '\n', ""Time came a-creepin'\n"", ""Oh and time's a loaded gun\n"", 'Every road is a ray of light\n', 'It goes o-o-on\n', 'Time only can lead you on\n', ""Still it's such a beautiful night\n"", '\n', ""Oh love don't let me go\n"", ""Won't you take me where the streetlights glow\n"", 'I could hear it coming\n', 'Like a serenade of sound\n', ""Now my feet won't touch the ground\n"", '\n', 'Gravity release me,\n', 'And dont ever hold me down\n', ""Now my feet won't touch the ground.""]"
54,Lost.txt,"[""Just because I'm losing\n"", ""Doesn't mean I'm lost\n"", ""Doesn't mean I'll stop\n"", ""Doesn't mean I would cross\n"", '\n', ""Just because I'm hurting\n"", ""Doesn't mean I'm hurt\n"", ""Doesn't mean I didn't get\n"", 'What I deserved\n', 'No better and no worse\n', '\n', 'I just got lost\n', 'Every river that I tried to cross\n', 'Every door I ever tried was locked\n', ""Ohhh and I'm...\n"", ""Just waiting 'til the shine wears off\n"", '\n', 'You might be a big fish\n', 'In a little pond\n', ""Doesn't mean you've won\n"", ""'Cause along may come\n"", 'A bigger one\n', '\n', ""And you'll be lost\n"", 'Every river that you tried to cross\n', 'Every gun you ever held went off\n', ""Ohhh and I'm...\n"", ""Just waiting 'til the firing stopped\n"", ""Ohhh and I'm...\n"", ""Just waiting 'til the shine wears off\n"", '\n', '[Guitar solo]\n', '\n', ""Ohhh and I'm...\n"", ""Just waiting 'til the shine wears off\n"", ""Ohhh and I'm...\n"", ""Just waiting 'til the shine wears off""]"
55,LoversInJapan.txt,"[""Lovers, keep on the road you're on \n"", 'Runners, until the race is run \n', ""Soldiers, you've got to soldier on \n"", 'Sometimes even right is wrong \n', '\n', 'They are turning my head out \n', ""To see what I'm all about \n"", 'Keeping my head down \n', 'To see what it feels like now \n', 'But I have no doubt \n', 'One day, we are gonna get out \n', '\n', ""Tonight maybe we're gonna run \n"", 'Dreaming of the Osaka sun \n', 'Ohh ohh... \n', 'Dreaming of when the morning comes \n', '\n', 'They are turning my head out \n', ""To see what I'm all about \n"", 'Keeping my head down \n', 'To see what it feels like now \n', 'But I have no doubt \n', 'One day the sun will come out \n', '\n', '...\n', '\n', 'Reign of love \n', 'I can\x92t let go \n', 'To the sea I offer \n', 'This heavy load \n', '\n', 'Locusts will \n', 'Lift me up \n', 'I\x92m just a prisoner \n', 'In a reign of love \n', '\n', 'Locusts will \n', 'Let us stop \n', 'I wish I\x92d spoken \n', 'To the reign of love \n', '\n', 'Reign of love \n', 'By the church, we\x92re waiting \n', 'Reign of love \n', 'My knees go praying \n', '\n', 'How I wish \n', 'I\x92d spoken up \n', 'Or we\x92d be carried \n', 'In the reign of love.\n']"
56,StrawberrySwing.txt,"['They were sitting \n', 'They were sitting on the strawberry swing \n', 'Every moment was so precious \n', '\n', 'They were sitting \n', 'They were talking under strawberry swing \n', 'Everybody was for fighting \n', ""Wouldn't wanna waste a thing \n"", '\n', 'Cold, cold water bring me round \n', ""Now my feet won't touch the ground \n"", 'Cold, cold water what ya say? \n', ""When it's such\x85 \n"", ""It's such a perfect day \n"", ""It's such a perfect day \n"", '\n', 'I remember \n', 'We were walking up to strawberry swing \n', ""I can't wait until the morning \n"", ""Wouldn't wanna change a thing \n"", '\n', 'People moving all the time \n', 'Inside a perfectly straight line \n', ""Don't you wanna curve away? \n"", ""When it's such\x85 \n"", ""It's such a perfect day \n"", ""It's such a perfect day \n"", '\n', 'Now the sky could be blue \n', ""I don't mind \n"", ""Without you it's a waste of time \n"", '\n', 'Could be blue \n', 'I don\x92t mind \n', 'Without you it\x92s a waste of time \n', '\n', 'Could be blue, \n', 'Could be grey \n', 'Without you I\x92m just miles away \n', '\n', 'Could be blue \n', 'I don\x92t mind \n', 'Without you it\x92s a waste of time']"
57,VioletHill.txt,"['It was a long and dark December\n', 'From the rooftops I remember\n', 'There was snow, white snow\n', '\n', 'Clearly I remember\n', 'From the windows they were watching\n', 'While we froze down below\n', '\n', ""When the future's architectured\n"", 'By a carnival of idiots on show\n', ""You'd better lie low\n"", '\n', ""If you love me, won't you let me know?\n"", '\n', 'Was a long and dark December\n', 'When the banks became cathedrals\n', 'And a fox became God\n', '\n', 'Priests clutched onto Bibles\n', 'Hollowed out to fit their rifles\n', 'And a cross was held aloft\n', '\n', 'Bury me in armour\n', ""When I'm dead and hit the ground\n"", 'My nerves are poles that unfroze\n', '\n', ""And if you love me, won't you let me know?\n"", '\n', ""I don't want to be a soldier\n"", 'Who the captain of some sinking ship\n', 'Would stow, far below.\n', '\n', ""So if you love me, why d'you let me go?\n"", '\n', 'I took my love down to violet hill\n', 'There we sat in snow\n', 'All that time she was silent still\n', '\n', ""Said if you love me, won't you let me know?\n"", ""If you love me, won't you let me know?\n""]"
58,VivaLaVida.txt,"['I used to rule the world\n', 'Seas would rise when I gave the word\n', 'Now in the morning I sleep alone\n', 'Sweep the streets I used to own\n', '\n', 'I used to roll the dice\n', ""Feel the fear in my enemy's eyes\n"", 'Listened as the crowd would sing\n', 'Now the old king is dead long live the king\n', 'One minute I held the key\n', 'Next the walls were closed on me\n', 'And I discovered that my castles stand\n', 'Upon pillars of salt and pillars of sand\n', '\n', 'I hear Jerusalem bells a-ringing\n', 'Roman cavalry choirs are singing\n', 'Be my mirror, my sword and shield\n', 'My missionaries in a foreign field\n', ""For some reason I can't explain\n"", ""Once you'd gone there was never\n"", 'Never an honest word\n', 'And that was when I ruled the world\n', '\n', 'It was a wicked and wild wind\n', 'Blew down the doors to let me in\n', 'Shattered windows and the sound of drums\n', ""People couldn't believe what I'd become\n"", 'Revolutionaries wait\n', 'For my head on a silver plate\n', 'Just a puppet on a lonely string\n', 'Oh who would ever want to be king?\n', '\n', 'I hear Jerusalem bells a-ringing\n', 'Roman cavalry choirs are singing\n', 'Be my mirror, my sword and shield\n', 'My missionaries in a foreign field\n', ""For some reason I can't explain\n"", ""I know St Peter won't call my name\n"", 'Never an honest word\n', 'But that was when I ruled the world\n', '\n', 'Oh oh oh oh ohh oh [x5]\n', '\n', 'Hear Jerusalem bells a-ringing\n', 'Roman cavalry choirs are singing\n', 'Be my mirror, my sword and shield\n', 'My missionaries in a foreign field\n', ""For some reason I can't explain\n"", ""I know St Peter won't call my name\n"", 'Never an honest word\n', 'But that was when I ruled the world']"
59,Yes.txt,"['When it started we had high hopes \n', ""Now my back's on the line \n"", ""My back's on the ropes \n"", '\n', 'When it started we were alright \n', 'But night makes a fool \n', 'of us in the daylight \n', '\n', 'Then we were dying of frustration \n', 'Saying Lord lead me not into temptation \n', 'But it\x92s not easy when she turns you on \n', 'Sin, stay gone \n', '\n', 'If you\x92d only, if you\x92d only say yes \n', ""Whether you will's anybody\x92s guess \n"", ""God only God knows I'm trying my best \n"", 'But I\x92m just so tired of this loneliness \n', '\n', 'Hey \n', '\n', 'So up they picked me by the big toe \n', 'I was held from the rooftop then they let go \n', ""Dizzily screaming 'Let the windows down' \n"", 'As I crawl to the ground \n', '\n', ""If you'd only if you'd only say yes \n"", ""Whether you will's anybody's guess \n"", ""God only God knows she won't let me rest \n"", ""But I'm just so tired of this loneliness \n"", ""I've become so tired of this loneliness\n""]"
60,AMessage.txt,"['My song is love\n', 'Love to the loveless shown\n', 'And it goes on\n', ""You don't have to be alone\n"", 'Your heavy heart\n', 'Is made of stone\n', ""And it's so hard to see you clearly\n"", ""You don't have to be on your own\n"", ""You don't have to be on your own\n"", '\n', ""And I'm not gonna take it back\n"", 'And I\'m not gonna say, ""I don\'t mean that""\n', ""You're the target that I'm aiming at\n"", 'Got to get that message home\n', '\n', 'My song is love\n', 'My song is love, unknown\n', ""But I'm on fire for you, clearly\n"", ""You don't have to be alone\n"", ""You don't have to be on your own\n"", '\n', ""And I'm not gonna take it back\n"", 'And I\'m not gonna say, ""I don\'t mean that""\n', ""You're the target that I'm aiming at\n"", ""And I'm nothing on my own\n"", 'Got to get that message home\n', '\n', ""And I'm not gonna stand and wait\n"", ""Not gonna leave it until it's much too late\n"", ""On a platform I'm gonna stand and say\n"", ""That I'm nothing on my own\n"", 'And I love you, please come home\n', '\n', 'My song is love, is love unknown\n', ""And I've got to get that message home\n""]"
61,FixYou_Singles.txt,"[""When you try your best, but you don't succeed\n"", 'When you get what you want, but not what you need\n', ""When you feel so tired, but you can't sleep\n"", 'Stuck in reverse\n', 'And the tears come streaming down your face\n', ""When you lose something you can't replace\n"", 'When you love someone, but it goes to waste\n', 'Could it be worse?\n', '\n', 'Lights will guide you home\n', 'And ignite your bones\n', 'And I will try to fix you\n', '\n', 'And high up above or down below\n', ""When you're too in love to let it go\n"", ""But if you never try you'll never know\n"", ""Just what you're worth\n"", '\n', 'Lights will guide you home\n', 'And ignite your bones\n', 'And I will try to fix you\n', '\n', 'Tears stream down your face\n', 'When you lose something you cannot replace\n', 'Tears stream down your face and I\n', 'Tears stream down your face\n', 'I promise you I will learn from my mistakes\n', 'Tears stream down your face and I\n', '\n', 'Lights will guide you home\n', 'And ignite your bones\n', 'And I will try to fix you\n']"
62,Low.txt,"['You see the world in black and white\n', 'No colour or light\n', ""You think you'll never get it right\n"", ""But you're wrong. You might.\n"", '\n', 'The sky could fall, could fall on me\n', 'The parting of the sea\n', 'But you mean more, mean more to me\n', 'Than any colour I can see\n', '\n', 'All you ever wanted was love,\n', 'But you never looked hard enough,\n', ""It's never gonna give itself up\n"", '\n', 'All you ever wanted to be\n', 'Living in perfect symmetry,\n', 'Nothing is as down or as up as us\n', '\n', 'You see the world in black and white\n', 'Not painted right\n', 'You see no meaning to your life\n', 'You should try\n', 'You should try\n', '\n', 'All you ever wanted was love,\n', 'But you never looked hard enough,\n', ""It's never gonna give itself up\n"", '\n', 'All you ever wanted to be,\n', 'Living in perfect symmetry,\n', 'Nothing is as down or as up\n', '\n', ""Don't you want to see it come soon,\n"", 'Floating in a big white balloon\n', 'Come give her your own silver spoon\n', '\n', ""Don't you want to see it come down?\n"", 'There for throwing your arms around\n', 'And say ""You\'re not a moment too soon.""\n', '\n', 'Cause I feel low, cause I feel low\n', 'ooooh...\n', 'Yeah I feel low\n', 'oh no...oooh\n', 'Cause I feel low, cause I feel low\n', 'oh...\n', 'Yet I feel low\n', 'oh no...oooh\n']"
63,SpeedOfSound.txt,"['How long before I get in?\n', 'Before it starts, before I begin?\n', 'How long before you decide?\n', 'Before I know what it feels like?\n', 'Where To, where do I go?\n', ""If you never try, then you'll never know.\n"", 'How long do I have to climb,\n', 'Up on the side of this mountain of mine?\n', '\n', 'Look up, I look up at night,\n', 'Planets are moving at the speed of light.\n', 'Climb up, up in the trees,\n', 'every chance that you get,\n', 'is a chance you seize.\n', 'How long am I gonna stand,\n', 'with my head stuck under the sand?\n', ""I'll start before I can stop,\n"", 'before I see things the right way up.\n', '\n', 'All that noise, and all that sound,\n', 'All those places I got found.\n', 'And birds go flying at the speed of sound,\n', 'to show you how it all began.\n', 'Birds came flying from the underground,\n', ""if you could see it then you'd understand?\n"", '\n', ""Ideas that you'll never find,\n"", 'All the inventors could never design.\n', 'The buildings that you put up,\n', 'Japan and China all lit up.\n', ""The sign that I couldn't read,\n"", ""or a light that I couldn't see,\n"", 'some things you have to believe,\n', 'but others are puzzles, puzzling me.\n', '\n', 'All that noise, and all that sound,\n', 'All those places I got found.\n', 'And birds go flying at the speed of sound,\n', 'to show you how it all began.\n', 'Birds came flying from the underground,\n', ""if you could see it then you'd understand,\n"", ""ah when you see it then you'll understand?\n"", '\n', 'All those signs, I knew what they meant.\n', 'Some things you can invent.\n', 'Some get made, and some get sent,\n', 'Ooh?\n', 'Birds go flying at the speed of sound,\n', 'to show you how it all began.\n', 'Birds came flying from the underground,\n', ""if you could see it then you'd understand,\n"", ""ah, when you see it then you'll understand?\n""]"
64,SqaureOne.txt,"[""ou're in control, is there anywhere you wanna go?\n"", ""You're in control, is there anything you wanna know?\n"", ""The future's for discovering\n"", ""The space in which we're travelling\n"", 'From the top of the first page\n', 'To the end of the last day\n', 'From the start in your own way\n', 'You just want somebody listening to what you say\n', ""It doesn't matter who you are\n"", ""It doesn't matter who you are\n"", '\n', 'Under the surface trying to break through\n', 'Deciphering the codes in you\n', 'I need a compass, draw me a map\n', ""I'm on the top, I can't get back\n"", '\n', 'Whoa whoa\n', '\n', 'The first line on the first page\n', 'To the end of the last page\n', 'From the start in your own way\n', 'You just want somebody listening to what you say\n', ""It doesn't matter who you are\n"", ""It doesn't matter who you are\n"", '\n', 'You just want\n', 'Somebody listening to what you say\n', 'Oh, you just want somebody listening to what you say\n', ""It doesn't matter who you are\n"", ""It doesn't matter who you are\n"", '\n', 'Is there anybody out there who\n', 'Is lost and hurt and lonely too\n', 'Are they bleeding all your colours into one?\n', 'and if you come undone\n', ""As if you've been run through\n"", 'Some catapult it fired you\n', 'You wonder if your chance will ever come\n', ""Or if you're stuck in square one""]"
